{
  "schema_version": 2,
  "diagnosis_id": "feedback-diagnosis-1",
  "object_version": 1,
  "status": "reviewed",
  "category": "pacing",
  "feedback": { "text": "开场太慢，把第一个镜头缩短一秒", "digest": "aaaaaaaaaaaaaaaaaaaaaaaaaaaaaaaaaaaaaaaaaaaaaaaaaaaaaaaaaaaaaaaa" },
  "base_execution_ref": { "object_id": "execution-first-cut", "object_version": 1, "digest": "bbbbbbbbbbbbbbbbbbbbbbbbbbbbbbbbbbbbbbbbbbbbbbbbbbbbbbbbbbbbbbbb" },
  "base_timeline_ref": { "version": 1, "digest": "cccccccccccccccccccccccccccccccccccccccccccccccccccccccccccccccc" },
  "target": {
    "track_id": "v1",
    "clip_id": "semantic:intent-first-cut:select-hook",
    "original_source": { "asset_id": "asset:sha256:dddddddddddddddddddddddddddddddddddddddddddddddddddddddddddddddd", "start": { "schema_version": 1, "value": 0, "timescale": 30 }, "end": { "schema_version": 1, "value": 90, "timescale": 30 } },
    "proposed_source": { "asset_id": "asset:sha256:dddddddddddddddddddddddddddddddddddddddddddddddddddddddddddddddd", "start": { "schema_version": 1, "value": 0, "timescale": 30 }, "end": { "schema_version": 1, "value": 60, "timescale": 30 } },
    "trim_duration": { "schema_version": 1, "value": 1, "timescale": 1 },
    "operation": "trim_semantic_range"
  },
  "authority_refs": {
    "approved_story_ref": { "object_id": "story-plan-1", "object_version": 1, "digest": "eeeeeeeeeeeeeeeeeeeeeeeeeeeeeeeeeeeeeeeeeeeeeeeeeeeeeeeeeeeeeeee" },
    "decision_refs": [{ "object_id": "decision-1", "object_version": 1, "digest": "ffffffffffffffffffffffffffffffffffffffffffffffffffffffffffffffff" }],
    "evidence_refs": [{ "object_id": "evidence-1", "object_version": 1, "digest": "1111111111111111111111111111111111111111111111111111111111111111" }],
    "contract_ref": { "object_id": "contract-1", "object_version": 2, "digest": "2222222222222222222222222222222222222222222222222222222222222222" },
    "capability_snapshot_ref": { "object_id": "capabilities-1", "object_version": 1, "digest": "3333333333333333333333333333333333333333333333333333333333333333" }
  },
  "affected_scope": ["clip:semantic:intent-first-cut:select-hook"],
  "reason": "用户明确要求收紧已接受开场镜头",
  "alternatives": ["保留当前已接受版本"],
  "confidence": { "score": 1, "basis": ["反馈包含一个现有镜头和确定向内范围"] },
  "input_fingerprint": "4444444444444444444444444444444444444444444444444444444444444444",
  "created_at": "2026-08-24T04:00:00Z",
  "provenance": { "producer": "project-host", "source_version": "feedback-diagnosis-v2", "policy_version": "feedback-policy-v1", "input_refs": ["execution-first-cut@1", "timeline@1"] }
}
